# name: test/sql/index/rtree_persistence_wal_append.test
# group: [index]

# Appends and deletes on an existing RTREE index are buffered during WAL replay (when spatial isn't
# loaded) and applied when the index is bound. Row ids arrive as a dictionary vector, which used to
# error with "Operation requires a flat vector", making the database uncheckpointable.
# See https://github.com/duckdb/duckdb-spatial/issues/861
#
# The runner checkpoints whenever the WAL is non-empty, so 'checkpoint_threshold' must be raised
# after each restart to keep the WAL alive.

require spatial

load __TEST_DIR__/rtree_persistence_wal_append.db

statement ok
SET checkpoint_threshold='1GB';

statement ok
PRAGMA disable_checkpoint_on_shutdown;

statement ok
CREATE TABLE t1 (geom GEOMETRY);

statement ok
CREATE INDEX my_idx ON t1 USING RTREE (geom);

# Insert after index creation so the appends go through the WAL
statement ok
INSERT INTO t1 SELECT ST_Point(x, y) FROM range(0, 100) r1(x), range(0, 100) r2(y);

query I
SELECT count(*) FROM t1 WHERE ST_Within(geom, ST_MakeEnvelope(9.5, 9.5, 20.5, 20.5));
----
121

restart

statement ok
SET checkpoint_threshold='1GB';

# Binding the index applies the buffered appends
query II
EXPLAIN SELECT count(*) FROM t1 WHERE ST_Within(geom, ST_MakeEnvelope(9.5, 9.5, 20.5, 20.5));
----
physical_plan	<REGEX>:.*RTREE_INDEX_SCAN.*

query I
SELECT count(*) FROM t1 WHERE ST_Within(geom, ST_MakeEnvelope(9.5, 9.5, 20.5, 20.5));
----
121

statement ok
INSERT INTO t1 VALUES (ST_Point(1000, 1000));

statement ok
CHECKPOINT;

query I
SELECT count(*) FROM t1;
----
10001

# Every row is in the index, not just in the table
query I
SELECT count(*) FROM rtree_index_dump('my_idx') WHERE row_id IS NOT NULL;
----
10001

# The same applies to deletes replayed from the WAL
statement ok
PRAGMA disable_checkpoint_on_shutdown;

statement ok
DELETE FROM t1 WHERE rowid < 1000;

restart

statement ok
SET checkpoint_threshold='1GB';

query I
SELECT count(*) FROM t1 WHERE ST_Within(geom, ST_MakeEnvelope(9.5, 9.5, 20.5, 20.5));
----
121

statement ok
CHECKPOINT;

query I
SELECT count(*) FROM t1;
----
9001

# The deleted rows are gone from the table
query I
SELECT count(*) FROM t1 WHERE ST_Within(geom, ST_MakeEnvelope(-0.5, -0.5, 9.5, 9.5));
----
0

# ...and from the index itself. The query above would pass regardless, since deleted rows are
# filtered out on fetch, so check the index directly for dangling entries.
query I
SELECT count(*) FROM rtree_index_dump('my_idx') WHERE row_id IS NOT NULL;
----
9001
